5-gram,frequency
algorithmes machine learning necessitent grandes,19
machine learning necessitent grandes quantites,19
learning necessitent grandes quantites donnees,19
outils visualisation comme matplotlib seaborn,19
visualisation comme matplotlib seaborn populaires,19
comme matplotlib seaborn populaires data,19
matplotlib seaborn populaires data science,19
preparation donnees etape fondamentale processus,19
donnees etape fondamentale processus data,19
etape fondamentale processus data science,19
lintelligence artificielle data science etroitement,19
artificielle data science etroitement liees,19
reseaux neurones utilises taches complexes,19
neurones utilises taches complexes data,19
utilises taches complexes data science,19
bases donnees relationnelles couramment utilisees,19
donnees relationnelles couramment utilisees stocker,19
relationnelles couramment utilisees stocker donnees,19
donnees non structurees peuvent etre,19
non structurees peuvent etre difficiles,19
structurees peuvent etre difficiles analyser,19
peuvent etre difficiles analyser sans,19
etre difficiles analyser sans techniques,19
difficiles analyser sans techniques avancees,19
nettoyage donnees ameliore qualite analyses,19
big data requierent technologies specifiques,19
data requierent technologies specifiques traitement,19
lanalyse temps reel donnees offre,19
temps reel donnees offre avantage,19
reel donnees offre avantage concurrentiel,19
data science essentielle lanalyse tendances,1
lanalyse donnees permet prendre decisions,1
donnees permet prendre decisions eclairees,1
modeles predictifs cur data science,1
python largement utilise lanalyse donnees,1
donnees structurees facilitent lextraction dinformations,1
lapprentissage automatique branche data science,1
visualisations donnees aident comprendre resultats,1
qualite donnees cruciale analyses precises,1
statistiques descriptives resument caracteristiques donnees,1
manipulation donnees competence cle data,1
donnees competence cle data science,1
